<?xml version="1.0" ?>
<!-- This file is for the Team B Project -->
<cust:Customers xmlns:xsi="http://www.w3.org/2001/XMLSchema-instance"
              xmlns:cust="http://riordan/teamB/ns"
              xsi:schemaLocation="http://riordan/teamB/ns TeamB.xsd">
<Customer>
	<name>Bickford Organic Juices</name>
	<street_address>101 manufacturing Way</street_address>
	<city>Somewheresville</city>
	<state>New York</state>
	<zipcode>11789</zipcode>
	<phone>212-555-5555</phone>
	<customer_number>0001</customer_number>
</Customer>
<Customer>
	<name>Brooks Chemical Supply</name>
	<street_address>500 manufacturing Way</street_address>
	<city>Somewheresville</city>
	<state>New York</state>
	<zipcode>11789</zipcode>
	<phone>212-555-7777</phone>
	<customer_number>0002</customer_number>
</Customer>

</cust:Customers>